省庁名,会計名,分類種類名,部局名,口座名,登記上の表示,住居表示,口座別合計価格　（円）,土地用途,土地合計数量　（u）,土地合計価格　（円）,土地取得年月日,土地取得事由,都市計画区域,用途地域,建ぺい率,容積率,法定容積率に対する利用率,建物用途,棟数,建物合計数量（建）　（u）,建物合計数量（延）　（u）,建物合計価格　（円）,宿舎戸数,主要建物用途,構造,階数,主要建物数量（建）　（u）,主要建物数量（延）　（u）,主要建物価格　（円）　,主要建物取得年月日,主要建物取得事由,立木竹価格　（円）,工作物価格　（円）,船舶数量,船舶価格　（円）,航空機数量,航空機価格　（円）,地上権等数量,地上権等価格　（円）,特許権等数量,特許権等価格　（円）
文部科学省,一般会計,公用財産,文部科学本省,研究交流センター,茨城県つくば市竹園２丁目２０−５,茨城県つくば市竹園２丁目２０−５,1499768199,庁舎等,12628.98,1398280665,1990.5.25,所管換,市街化区域,商業地域,80,400,7,試験研究施設,1,1555.60,3663.63,94618210,0,試験研究施設,ＲＣ,3,1555.60,3663.63,94618210,1975.11.11,新築,2938373,3930951,0,0,0,0,0,0,0,0
文部科学省,一般会計,公用財産,文部科学本省,外国人研究者宿泊施設,茨城県つくば市松代１丁目２４−１,茨城県つくば市松代１−２４,443192276,庁舎等,8314.09,364157142,1987.7.1,購入,市街化区域,第一種中高層住居専用地域,60,200,16,試験研究施設,12,2228.16,2802.48,76965827,0,試験研究施設,ＲＣ,2,185.68,233.54,6426612,1987.7.1,所管換,873752,1195555,0,0,0,0,0,0,0,0
文部科学省,一般会計,公用財産,文部科学本省,中央合同庁舎第７号館,東京都千代田区霞が関３丁目９４外,東京都千代田区霞が関３丁目２−２,184754479460,庁舎等,20001.56,150806321975,2004.12.22,権利変換,市街化区域,商業地域,70,1000,93,事務庁舎,5,13279.00,188013.26,29315587843,0,事務庁舎,ＳＲＣ,33,5907.91,117200.69,17498400485,2007.9.28,帰属,31953827,4583535492,0,0,0,0,0,0,1886.00,17080323
文部科学省,一般会計,公用財産,文部科学本省,タイムカプセルＥＸＰＯ’７０,大阪府大阪市中央区大阪城１−１,大阪府大阪市中央区大阪城１,24068655,庁舎等,36,248176,1971.5.27,所管換,市街化区域,第二種住居地域,80,200,0,-,0,0,0,0,0,-,-,-,0,0,0,-,-,0,23820479,0,0,0,0,0,0,0,0
文部科学省,一般会計,公用財産,文部科学本省,文部科学省資料保管所,東京都文京区白山２丁目１４２−８,東京都文京区白山２丁目３１−４,285203446,庁舎等,437.05,201455575,1996.4.12,用途変更,市街化区域,第一種住居地域,60,300,45,事務庁舎　外,1,226.48,595.79,80599022,0,書庫,ＲＣ,2,226.48,595.79,80599022,1997.3.19,新築,1991727,1157122,0,0,0,0,0,0,0,0
文部科学省,一般会計,公用財産,文部科学本省,久里浜宿舎,神奈川県横須賀市久里浜６丁目６４２−１５　外,神奈川県横須賀市久里浜６−１１−３,33354,-,0,0,-,-,-,-,-,-,-,-,0,0,0,0,0,-,-,-,0,0,0,-,-,0,33354,0,0,0,0,0,0,0,0
文部科学省,一般会計,公用財産,文部科学本省,大雪青年の家旭町宿舎,北海道上川郡美瑛町旭町２丁目３７４番地,北海道上川郡美瑛町旭町２丁目３７４番地,73548934,宿舎,2167.85,16096286,2001.4.1,所属替,非線引,第一種低層住居専用地域,40,60,75,宿舎,4,425.85,995,49816918,14,宿舎,ＲＣ,3,244.97,639.04,29984309,2001.4.1,所属替,0,7635730,0,0,0,0,0,0,0,0
文部科学省,一般会計,公用財産,文部科学本省,磐梯青年の家宿舎,福島県耶麻郡猪苗代町西６４−１,福島県耶麻郡猪苗代町字町西６４−１,38618901,-,0,0,-,-,-,-,-,-,-,宿舎　外,2,310.63,995.03,38379589,10,宿舎,ＲＣ,4,303.38,987.78,38085816,2001.4.1,所属替,0,239312,0,0,0,0,0,0,0,0
文部科学省,一般会計,公用財産,文部科学本省,中央青年の家玉穂宿舎,静岡県御殿場市中畑５１９−１４,静岡県御殿場市中畑５１９−１３,169714164,宿舎,3032.66,111444189,2001.4.1,所属替,市街化調整区域,都市計画用途地域指定なし,60,200,16,宿舎,1,348.3,984.66,52097221,11,宿舎,ＲＣ,3,348.3,984.66,52097221,2001.4.1,所属替,0,6172754,0,0,0,0,0,0,0,0
文部科学省,一般会計,公用財産,文部科学本省,淡路青年の家宿舎,兵庫県南あわじ市５６９−１,兵庫県南あわじ市阿万西町５６９−１,8294522,-,0,0,-,-,-,-,-,-,-,宿舎,7,641.63,641.63,7913078,10,宿舎,ＲＣ,1,96.04,96.04,1333702,2001.4.1,所属替,0,381444,0,0,0,0,0,0,0,0
文部科学省,一般会計,公用財産,文部科学本省,江田島青年の家宿舎,広島県江田島市江田島町中央一丁目１７９５５−５,広島県江田島市江田島町中央一丁目１５−６,49701339,宿舎,1352.64,18011754,2001.4.1,所属替,非線引,第一種住居地域,60,200,30,宿舎,3,301.45,813.15,30163055,5,宿舎,ＲＣ,3,271.25,782.95,29879731,2001.4.1,所属替,589114,937416,0,0,0,0,0,0,0,0
文部科学省,一般会計,公用財産,文部科学本省,阿蘇青年の家宿舎,熊本県阿蘇市一の宮町坂梨３０３５−３,熊本県阿蘇市一の宮町坂梨３０３５−３,27318760,-,0,0,-,-,-,-,-,-,-,宿舎,2,140.19,546.27,26995271,8,宿舎,ＲＣ,5,135.36,541.44,26291441,2001.4.1,所属替,0,323489,0,0,0,0,0,0,0,0
文部科学省,一般会計,公用財産,文部科学本省,沖縄青年の家宿舎,沖縄県島尻郡渡嘉敷村字渡嘉敷７４,沖縄県島尻郡渡嘉敷村字渡嘉敷７４,82062930,-,0,0,-,-,-,-,-,-,-,宿舎,3,554.46,1099.81,75784718,16,宿舎,ＲＣ,2,266.61,528.85,37786364,2001.4.1,所属替,0,6278212,0,0,0,0,0,0,0,0
文部科学省,一般会計,公用財産,文部科学本省,日高少年自然の家宿舎,北海道沙流郡日高町若葉町１丁目９９番３,北海道沙流郡日高町若葉町１丁目９９番３,22782303,-,0,0,-,-,-,-,-,-,-,宿舎,4,478.53,860.31,22712795,13,宿舎,Ｂ,2,141.26,278.57,7226996,2001.4.1,所属替,0,69508,0,0,0,0,0,0,0,0
文部科学省,一般会計,公用財産,文部科学本省,花山少年自然の家宿舎,宮城県栗原市字本沢北の前１０２−３,宮城県栗原市字本沢北の前１０２−３,15693569,-,0,0,-,-,-,-,-,-,-,宿舎,10,667.37,667.37,14906611,10,宿舎,Ｂ,1,85.61,85.61,2828345,2001.4.1,所属替,0,786958,0,0,0,0,0,0,0,0
文部科学省,一般会計,公用財産,文部科学本省,那須甲子少年自然の家上野原宿舎,福島県西白河郡西郷村大字小田倉字上野原３８６,福島県西白河郡西郷村大字小田倉字上野原３８６,38496486,宿舎,1144.51,12721228,2001.4.1,所属替,非線引,第一種住居地域,60,200,27,宿舎,1,207.87,623.61,24843574,18,宿舎,ＲＣ,3,207.87,623.61,24843574,2001.4.1,所属替,0,931684,0,0,0,0,0,0,0,0
文部科学省,一般会計,公用財産,文部科学本省,妙高少年自然の家宿舎,新潟県妙高市大字関山字大坪２１１８−１　外,新潟県妙高市大字関山２１１８−１,48725853,-,0,0,-,-,-,-,-,-,-,宿舎,3,300.51,811.73,47597209,7,宿舎,ＲＣ,3,283.55,794.77,46897900,2001.4.1,所属替,0,1128644,0,0,0,0,0,0,0,0
文部科学省,一般会計,公用財産,文部科学本省,立山少年自然の家宿舎,富山県中新川郡立山町岩峅寺字西出戸５７−１,富山県中新川郡立山町岩峅寺字西出戸５７−１,16030408,-,0,0,-,-,-,-,-,-,-,宿舎,3,284.51,774.67,15729019,4,宿舎,ＲＣ,3,259.58,749.74,15567874,2001.4.1,所属替,0,301389,0,0,0,0,0,0,0,0
文部科学省,一般会計,公用財産,文部科学本省,若狭湾少年自然の家宿舎,福井県三方上中郡若狭町大鳥羽１６,福井県三方上中郡若狭町大鳥羽１６,24620375,-,0,0,-,-,-,-,-,-,-,宿舎,3,270.61,748.69,23655461,10,宿舎,ＲＣ,3,239.04,717.12,23421856,2001.4.1,所属替,0,964914,0,0,0,0,0,0,0,0
文部科学省,一般会計,公用財産,文部科学本省,信州高遠少年自然の家宿舎,長野県伊那市高遠町西高遠１０１９,長野県伊那市高遠町西高遠１０１９,39232231,-,0,0,-,-,-,-,-,-,-,宿舎,3,294.75,811.65,37032704,6,宿舎,ＲＣ,3,277.87,794.77,36513654,2001.4.1,所属替,0,2199527,0,0,0,0,0,0,0,0
文部科学省,一般会計,公用財産,文部科学本省,曽爾少年自然の家宿舎,奈良県宇陀郡曽爾村太良路３５５,奈良県宇陀郡曽爾村太良路３５５,12341713,-,0,0,-,-,-,-,-,-,-,宿舎,4,297.54,566.82,12190698,7,宿舎,ＲＣ,2,138.38,273.02,6035678,2001.4.1,所属替,118917,32098,0,0,0,0,0,0,0,0
文部科学省,一般会計,公用財産,文部科学本省,吉備少年自然の家宿舎,岡山県加賀郡吉備中央町大字吉川字摺子鉢４４３４,岡山県加賀郡吉備中央町大字吉川字摺子鉢４４３４,11009088,-,0,0,-,-,-,-,-,-,-,宿舎,3,320.15,428.15,10638984,7,宿舎,Ｂ,2,108,216,5421708,2001.4.1,所属替,0,370104,0,0,0,0,0,0,0,0
文部科学省,一般会計,公用財産,文部科学本省,山口徳地少年自然の家宿舎,山口県山口市徳地堀字上善光寺２７５２番地,山口県山口市徳地堀２７５２,25360312,-,0,0,-,-,-,-,-,-,-,宿舎,5,347,834,24456033,5,宿舎,ＲＣ,3,243,730,20519328,2001.4.1,所属替,664036,240243,0,0,0,0,0,0,0,0
文部科学省,一般会計,公用財産,文部科学本省,室戸少年自然の家宿舎,高知県室戸市元字井々谷口甲１４３７,高知県室戸市元甲１４３７,10177545,-,0,0,-,-,-,-,-,-,-,宿舎,8,510.37,792.68,8951281,13,宿舎,Ｂ,2,134,256,3016201,2001.4.1,所属替,0,1226264,0,0,0,0,0,0,0,0
文部科学省,一般会計,公用財産,文部科学本省,三鷹深大寺宿舎,東京都調布市深大寺東町７−４４−２７,東京都調布市深大寺東町７−４３−３,279281588,宿舎,1629.56,181666982,2001.4.1,所属替,市街化区域,第一種住居地域,60,200,33,宿舎,1,436.1,1107.85,79527276,41,宿舎,ＲＣ,3,436.1,1107.85,79527276,2001.4.1,所属替,0,18087330,0,0,0,0,0,0,0,0
文部科学省,一般会計,公用財産,文部科学本省,千間台宿舎,埼玉県越谷市千間台西１−２５−２,埼玉県越谷市千間台西１−２５−２,260691681,宿舎,1363.89,176220043,2006.3.1,所管換,市街化区域,第二種中高層住居専用地域,60,200,46,宿舎,2,314.04,1264.59,84052065,48,宿舎,ＲＣ,5,281.64,1232.19,83939899,2006.3.1,所管換,0,419573,0,0,0,0,0,0,0,0
文部科学省,一般会計,公用財産,文部科学本省,ＮＴＣ競技別強化拠点施設高度化事業,東京都千代田区霞が関３丁目９４外,東京都千代田区霞が関３丁目２番２号,4005867,-,0,0,-,-,-,-,-,-,-,-,0,0,0,0,0,-,-,-,0,0,0,-,-,0,0,1,4005867,0,0,0,0,0,0
文部科学省,一般会計,公用財産,文部科学本省,チーム「ニッポン」マルチ・サポート事業,茨城県つくば市天王台１−１−１,茨城県つくば市天王台１−１−１,15003315,-,0,0,-,-,-,-,-,-,-,-,0,0,0,0,0,-,-,-,0,0,0,-,-,0,0,9,15003315,0,0,0,0,0,0
文部科学省,一般会計,公用財産,文部科学本省,久里浜宿舎,神奈川県横須賀市久里浜７−１２６,神奈川県横須賀市久里浜７−１２６,203408019,宿舎,1300.78,138767210,2015.7.1,所管換（無償）,市街化区域,第一種中高層住居専用地域,60,200,52,宿舎,1,283.4,1378.60,63999068,20,宿舎,ＲＣ,5,283.4,1378.60,63999068,2015.7.1,所管換（無償）,10775,630966,0,0,0,0,0,0,0,0
文部科学省,一般会計,公用財産,国立教育政策研究所,国立教育政策研究所上野庁舎,東京都台東区上野公園１２−４３,東京都台東区上野公園１２−４３,1734898279,庁舎,3150.33,1546244970,2001.4.1,帰属,市街化区域,第一種中高層住居専用地域,60,300,24,事務庁舎,1,813.18,2359.39,149631241,0,事務庁舎,ＲＣ,3,813.18,2359.39,149631241,2001.4.1,帰属,5634251,33387817,0,0,0,0,0,0,0,0
文部科学省,一般会計,公用財産,日本学士院,日本学士院,東京都台東区上野公園７−３２,東京都台東区上野公園７−３２,6765851,-,0,0,-,-,-,-,-,-,-,-,0,0,0,0,0,-,-,-,0,0,0,-,-,0,6765851,0,0,0,0,0,0,0,0
文部科学省,一般会計,公用財産,日本学士院,日本学士院,東京都台東区上野公園,東京都台東区上野公園７−３２,385485367,-,0,0,-,-,-,-,-,-,-,事務庁舎　外,1,1282.04,4792.64,224250561,0,庁舎,ＳＲＣ,3,1282.04,4792.64,224250561,1974.5.27,新築,4522719,156712087,0,0,0,0,0,0,0,0
文部科学省,一般会計,公用財産,文化庁,史跡　尼寺廃寺跡,奈良県香芝市尼寺２丁目７６,奈良県香芝市尼寺２丁目７６,596767,その他,133.41,596767,2003.5.8,所管換,非線引,都市計画用途地域指定なし,-,-,-,-,0,0,0,0,0,-,-,-,0,0,0,-,-,0,0,0,0,0,0,0,0,0,0
文部科学省,一般会計,公用財産,文化庁,史跡　斎宮跡,三重県多気郡明和町大字斎宮字東前沖２５０５−４,三重県多気郡明和町大字斎宮字東前沖２５０５−４,62866270,その他,3864.14,62866270,2005.2.21,購入,非線引,都市計画用途地域指定なし,-,-,-,-,0,0,0,0,0,-,-,-,0,0,0,-,-,0,0,0,0,0,0,0,0,0,0
文部科学省,一般会計,公用財産,文化庁,日本芸術院,東京都台東区上野公園,東京都台東区上野公園１−３０,585055761,-,0,0,-,-,-,-,-,-,-,事務庁舎　外,2,1414.39,2232.09,448130200,0,事務庁舎,ＳＲＣ,1,1131.50,1245.98,1,1968.6.15,所属替,447492,136478069,0,0,0,0,0,0,0,0
文部科学省,一般会計,公用財産,文化庁,特別史跡　藤原宮跡,奈良県橿原市高殿町１０５番,奈良県橿原市高殿町１０５番,438706093,その他,17629.21,438706093,2011.3.24,購入,市街化調整区域,都市計画用途地域指定なし,70,400,0,-,0,0,0,0,0,-,-,-,0,0,0,-,-,0,0,0,0,0,0,0,0,0,0
文部科学省,一般会計,公用財産,文化庁,特別史跡　五稜郭跡,北海道函館市五稜郭町１−１　外,北海道函館市五稜郭町１−１,1404888599,その他,250835.51,1401100538,1963.1.10,所属替,市街化区域,第二種中高層住居専用地域,60,200,0,その他,1,198.38,198.38,1,0,文化財,その他,1,198.38,198.38,1,1963.1.10,所属替,3788057,3,0,0,0,0,0,0,0,0
文部科学省,一般会計,公用財産,文化庁,史跡　津軽氏城跡（弘前城跡）,青森県弘前市下白銀町１−７,青森県弘前市下白銀町１−７,825882004,その他,61392.43,825733068,1976.6.29,所属替,都市計画区域外,都市計画用途地域指定なし,-,-,-,-,0,0,0,0,0,-,-,-,0,0,0,-,-,148934,2,0,0,0,0,0,0,0,0
文部科学省,一般会計,公用財産,文化庁,特別名勝　毛越寺庭園,岩手県西磐井郡平泉町平泉字大沢,岩手県西磐井郡平泉町平泉字大沢３３,41336,その他,3646.57,41336,1967.10.20,所管換,市街化調整区域,都市計画用途地域指定なし,70,400,0,-,0,0,0,0,0,-,-,-,0,0,0,-,-,0,0,0,0,0,0,0,0,0,0
文部科学省,一般会計,公用財産,文化庁,特別史跡　多賀城跡附寺跡,宮城県多賀城市市川字田屋場,宮城県多賀城市川字田屋場５４,1997352,その他,2797.32,1994471,1963.1.10,所属替,市街化調整区域,都市計画用途地域指定なし,70,400,0,-,0,0,0,0,0,-,-,-,0,0,0,-,-,2879,2,0,0,0,0,0,0,0,0
文部科学省,一般会計,公用財産,文化庁,史跡　陸奥国分寺跡,宮城県仙台市若林区木ノ下６９,宮城県仙台市若林区木の下６９,66410662,その他,9515.35,66410662,1963.1.10,所属替,市街化区域,第二種住居地域,60,200,0,-,0,0,0,0,0,-,-,-,0,0,0,-,-,0,0,0,0,0,0,0,0,0,0
文部科学省,一般会計,公用財産,文化庁,天然記念物　陸前江ノ島のウミネコおよびウトウ繁殖地,宮城県牡鹿郡女川町江ノ島字荒薮小島,宮城県牡鹿郡女川町江ノ島字荒藪小島１,2756712,その他,14386.33,2756712,1963.1.10,所属替,都市計画区域外,都市計画用途地域指定なし,-,-,-,-,0,0,0,0,0,-,-,-,0,0,0,-,-,0,0,0,0,0,0,0,0,0,0
文部科学省,一般会計,公用財産,文化庁,天然記念物　小原の材木岩,宮城県白石市小原字清水,宮城県白石市小原字清水３４,182003,その他,3338.84,182003,1963.1.10,所属替,都市計画区域外,都市計画用途地域指定なし,-,-,-,-,0,0,0,0,0,-,-,-,0,0,0,-,-,0,0,0,0,0,0,0,0,0,0
文部科学省,一般会計,公用財産,文化庁,天然記念物　芝谷地湿原植物群落,秋田県大館市釈迦内字ヲコハ５０,秋田県大館市釈迦内字ヲコハ５０,1563252,その他,11188.76,1563252,1963.1.10,所属替,都市計画区域外,都市計画用途地域指定なし,-,-,-,-,0,0,0,0,0,-,-,-,0,0,0,-,-,0,0,0,0,0,0,0,0,0,0
文部科学省,一般会計,公用財産,文化庁,史跡　新地貝塚附手長明神社跡,福島県相馬郡新地町小川字貝塚西,福島県相馬郡新地町小川字貝塚西５１,188150,その他,1048.73,188150,1963.1.10,所属替,市街化調整区域,都市計画用途地域指定なし,70,400,0,-,0,0,0,0,0,-,-,-,0,0,0,-,-,0,0,0,0,0,0,0,0,0,0
文部科学省,一般会計,公用財産,文化庁,天然記念物　賢沼ウナギ生息地,福島県いわき市平沼ノ内字代の下,福島県いわき市平沼ノ内字代の下１０２,951659,その他,21818.18,951659,1963.1.10,所属替,市街化調整区域,都市計画用途地域指定なし,70,400,0,-,0,0,0,0,0,-,-,-,0,0,0,-,-,0,0,0,0,0,0,0,0,0,0
文部科学省,一般会計,公用財産,文化庁,天然記念物　駒止湿原,福島県大沼郡昭和村大芦字大山,福島県大沼郡昭和村大芦字大山４９０３−５,899556,その他,333923.00,899556,1976.3.31,所管換,都市計画区域外,都市計画用途地域指定なし,-,-,-,-,0,0,0,0,0,-,-,-,0,0,0,-,-,0,0,0,0,0,0,0,0,0,0
文部科学省,一般会計,公用財産,文化庁,史跡　愛宕山古墳,茨城県水戸市愛宕町,茨城県水戸市愛宕町２１３２−１,127147,その他,4171.90,58301,1963.1.10,所属替,市街化調整区域,都市計画用途地域指定なし,60,200,0,-,0,0,0,0,0,-,-,-,0,0,0,-,-,68846,0,0,0,0,0,0,0,0,0
文部科学省,一般会計,公用財産,文化庁,史跡　舟塚山古墳,茨城県石岡市北根本字舟塚根５９６外,茨城県石岡市北根本字舟塚根５９６,34228,その他,13582.26,34228,1963.1.10,所属替,市街化調整区域,都市計画用途地域指定なし,70,400,0,-,0,0,0,0,0,-,-,-,0,0,0,-,-,0,0,0,0,0,0,0,0,0,0
文部科学省,一般会計,公用財産,文化庁,特別史跡　常陸国分尼寺跡,茨城県石岡市大字石岡字尼寺ヶ原８８３９−２外,茨城県石岡市大字石岡字尼寺ヶ原８８３９−２,1044,その他,294.21,1044,1963.1.10,所属替,市街化区域,第二種中高層住居専用地域,60,200,0,-,0,0,0,0,0,-,-,-,0,0,0,-,-,0,0,0,0,0,0,0,0,0,0
文部科学省,一般会計,公用財産,文化庁,史跡　関城跡,茨城県筑西市関館字内館,茨城県筑西市関館字内館６４,122,その他,181.81,122,1963.1.10,所属替,市街化調整区域,都市計画用途地域指定なし,70,400,0,-,0,0,0,0,0,-,-,-,0,0,0,-,-,0,0,0,0,0,0,0,0,0,0
文部科学省,一般会計,公用財産,文化庁,史跡　下野国分寺跡,栃木県下野市国分甲字東薬師堂,栃木県下野市国分甲字東薬師堂８６９,651754,その他,4366.94,651754,1963.1.10,所属替,市街化調整区域,都市計画用途地域指定なし,70,400,0,-,0,0,0,0,0,-,-,-,0,0,0,-,-,0,0,0,0,0,0,0,0,0,0
文部科学省,一般会計,公用財産,文化庁,史跡　二子山古墳（１）,群馬県前橋市文京町,群馬県前橋市文京町３丁目１５７−３,4179750,その他,6756.71,4179750,1963.1.10,所属替,市街化区域,第一種住居地域,60,200,0,-,0,0,0,0,0,-,-,-,0,0,0,-,-,0,0,0,0,0,0,0,0,0,0
文部科学省,一般会計,公用財産,文化庁,史跡　二子山古墳（２）,群馬県前橋市総社町植野字二子山,群馬県前橋市総社町植野字二子山３６８,3195574,その他,5166.94,3195574,1963.1.10,所属替,市街化区域,第一種中高層住居専用地域,60,200,0,-,0,0,0,0,0,-,-,-,0,0,0,-,-,0,0,0,0,0,0,0,0,0,0
文部科学省,一般会計,公用財産,文化庁,史跡　七輿山古墳,群馬県藤岡市上落合七輿,群馬県藤岡市上落合七輿８３１−１,1645403,その他,11996.69,1645403,1963.1.10,所属替,市街化調整区域,都市計画用途地域指定なし,70,400,0,-,0,0,0,0,0,-,-,-,0,0,0,-,-,0,0,0,0,0,0,0,0,0,0
文部科学省,一般会計,公用財産,文化庁,特別史跡　多胡碑,群馬県高崎市池字御門,群馬県高崎市池字御門１０９５,3207435,その他,2691.73,3207435,1963.1.10,所属替,市街化調整区域,都市計画用途地域指定なし,70,400,0,-,0,0,0,0,0,-,-,-,0,0,0,-,-,0,0,0,0,0,0,0,0,0,0
文部科学省,一般会計,公用財産,文化庁,特別史跡　金井沢碑,群馬県高崎市山名町字金井沢,群馬県高崎市山名町字金井沢２３３４,34818,その他,255.96,34818,1963.1.10,所属替,市街化調整区域,都市計画用途地域指定なし,70,400,0,-,0,0,0,0,0,-,-,-,0,0,0,-,-,0,0,0,0,0,0,0,0,0,0
文部科学省,一般会計,公用財産,文化庁,特別史跡　山上碑および古墳,群馬県高崎市山名町字山神谷２１０４,群馬県高崎市山名町字山神谷２１０４,115926,その他,845.93,115926,1963.1.10,所属替,市街化調整区域,都市計画用途地域指定なし,70,400,0,-,0,0,0,0,0,-,-,-,0,0,0,-,-,0,0,0,0,0,0,0,0,0,0
文部科学省,一般会計,公用財産,文化庁,天然記念物　成東・東金食虫植物群落,千葉県山武市島字畑田,千葉県山武市島字畑田４６４−８,3952426,その他,31194.15,3952426,1963.1.10,所属替,市街化調整区域,都市計画用途地域指定なし,70,400,0,-,0,0,0,0,0,-,-,-,0,0,0,-,-,0,0,0,0,0,0,0,0,0,0
文部科学省,一般会計,公用財産,文化庁,史跡　武蔵国分寺跡,東京都国分寺市西元町２丁目,東京都国分寺市西元町２−１６１２,69185171,その他,5321.41,69185171,1963.1.10,所属替,市街化区域,第一種低層住居専用地域,30,60,0,-,0,0,0,0,0,-,-,-,0,0,0,-,-,0,0,0,0,0,0,0,0,0,0
文部科学省,一般会計,公用財産,文化庁,史跡　西ケ原一里塚,東京都北区西ケ原,東京都北区西ケ原２−９５０,4638828,その他,208.26,4638828,1963.1.10,所属替,市街化区域,近隣商業地域,80,400,0,-,0,0,0,0,0,-,-,-,0,0,0,-,-,0,0,0,0,0,0,0,0,0,0
文部科学省,一般会計,公用財産,文化庁,史跡　志村一里塚,東京都板橋区志村,東京都板橋区志村１−５７,6774385,その他,265.2,6774385,1963.1.10,所属替,市街化区域,第一種住居地域,60,200,0,-,0,0,0,0,0,-,-,-,0,0,0,-,-,0,0,0,0,0,0,0,0,0,0
文部科学省,一般会計,公用財産,文化庁,天然記念物　三宝寺池沼沢植物群落,東京都練馬区石神井台,東京都練馬区石神井台１−１９０８,10531010,その他,3259.50,10531010,1963.1.10,所属替,市街化区域,第一種低層住居専用地域,30,60,0,-,0,0,0,0,0,-,-,-,0,0,0,-,-,0,0,0,0,0,0,0,0,0,0
文部科学省,一般会計,公用財産,文化庁,特別史跡・特別名勝　小石川後楽園,東京都文京区後楽,東京都文京区後楽１丁目４−１１,6568925565,その他,68859.50,6566120702,1963.1.10,所属替,市街化区域,第一種住居地域,60,300,0,その他,2,19.82,19.82,2,0,文化財,Ｗ,0,16.52,16.52,1,1963.1.10,所属替,2804857,4,0,0,0,0,0,0,0,0
文部科学省,一般会計,公用財産,文化庁,特別史跡　江戸城跡,東京都千代田区北の丸公園２−５,東京都千代田区北の丸公園２−５,1086293195,その他,5880.61,1081963367,1965.5.14,所管換,市街化区域,第一種住居地域,60,300,0,-,0,0,0,0,0,-,-,-,0,0,0,-,-,29314,4300514,0,0,0,0,0,0,0,0
文部科学省,一般会計,公用財産,文化庁,史跡　江戸城外堀跡,東京都千代田区霞ケ関,東京都千代田区霞ケ関３丁目７−２,4715115,その他,160.33,4715115,1964.7.14,所管換,市街化区域,第一種住居地域,80,500,0,-,0,0,0,0,0,-,-,-,0,0,0,-,-,0,0,0,0,0,0,0,0,0,0
文部科学省,一般会計,公用財産,文化庁,史跡　湯島聖堂,東京都文京区湯島１−２０２,東京都文京区湯島１丁目４−２５,2988306620,その他,15315.76,2984199491,1953.4.1,所属替,市街化区域,第一種住居地域,60,400,2,その他,12,1362.69,1362.69,12,0,その他,ＲＣ,1,295.8,295.8,1,1953.4.1,所属替,4107106,11,0,0,0,0,0,0,0,0
文部科学省,一般会計,公用財産,文化庁,史跡　三浦安針墓,神奈川県横須賀市西逸見町,神奈川県横須賀市西逸見町３丁目５７−１,7408845,その他,1352.06,7408845,1963.1.10,所属替,市街化調整区域,都市計画用途地域指定なし,70,400,0,-,0,0,0,0,0,-,-,-,0,0,0,-,-,0,0,0,0,0,0,0,0,0,0
文部科学省,一般会計,公用財産,文化庁,史跡　箱根関跡,神奈川県足柄下郡箱根町箱根字小田原町,神奈川県足柄下郡箱根町箱根字小田原町６−４,8055725,その他,3761.98,8055725,1963.1.10,所属替,都市計画区域外,都市計画用途地域指定なし,-,-,-,-,0,0,0,0,0,-,-,-,0,0,0,-,-,0,0,0,0,0,0,0,0,0,0
文部科学省,一般会計,公用財産,文化庁,史跡　元箱根石仏群,神奈川県足柄下郡箱根町元箱根字提灯山,神奈川県足柄下郡箱根町元箱根字提灯山１１４−ロ,103594,その他,138.34,103594,1963.1.10,所属替,都市計画区域外,都市計画用途地域指定なし,-,-,-,-,0,0,0,0,0,-,-,-,0,0,0,-,-,0,0,0,0,0,0,0,0,0,0
