34,2015,財務省,0003,官庁会計システム（歳入金電子納付システムを含む）,昭和５２年度～終了予定なし,会計センター,管理運用部,一般会計,1-3予算執行の透明性の向上・適正な予算執行の確保,-(参考)財務省組織令第68条,①予算・決算業務の業務・システム最適化計画（平成18年3月31日各府省情報化統括責任者(CIO)連絡会議決定）②e-Japan重点計画（平成13年3月29日ＩＴ戦略本部決定）,ＩＴ戦略,官庁会計システムは、国（全府省を対象）の会計事務における各種会計情報(予算の執行から決算の過程まで)を電子化し、統一的に処理することにより、会計事務の適正化・効率化を図ることを目的としている。また、歳入金電子納付システムは、電子申請・届出等に係る行政手数料等の電子納付を実現することにより、国民等の利便性の向上を図るとともに、行政運営の簡素化・効率化の向上に資することを目的としている。,官庁会計システムは、各官署に整備される職員用パソコンと会計センターの電子計算機とを政府共通ネットワーク等で結び、国の会計事務(予算の執行から決算の過程まで)を一括集中処理するシステムであり、会計センターでは当該システムの開発及び管理・運用を行っている。また、歳入金電子納付システムは、民間収納インフラ（マルチペイメントネットワーク）を活用し、納付の原因の確認を行うための各府省の共同利用型のシステムであり、会計センターで開発及び管理・運用を行っている。,直接実施,http://www.mof.go.jp/about_mof/mof_budget/review/2015/saishu/260003sheet.xls
35,2015,外務省,0087,領事システム,平成２３年度～終了予定なし,領事局,政策課,一般会計,Ⅳ領事政策Ⅳ－１領事業務の充実0083,外務省設置法第４条第８～１４号旅券法第１６条,領事業務の抜本的改革(平成13年)電子政府構築計画（2003年各府省CIO連絡会議決定）領事業務の業務・システム最適化計画（2006年外務省情報化推進委員会決定，2010年改定）,,外務省改革の一環としての「領事業務の抜本的改革」や行政手続等の電子化推進・電子政府構築計画等に基づき、領事窓口サービスの改善や邦人保護体制の拡充、業務の効率化を目的として、領事業務のＯＡ化を維持・推進するとともに，「領事業務の業務・システム最適化計画」に則り、国民サービスの向上および領事業務・システムの効率的な運用を目指す。,年間約３２０万人に発給する「旅券発給管理システム」、全世界で約１２９万人(平成２６年１０月)に上る在留邦人の在留届データを管理する「領事関連データ管理システム」、在留届のオンライン届出システムである「在留届電子届出システム」、領事窓口業務（在外選挙、戸籍・国籍業務、邦人援護統計事務等)を支援する領事利便支援システム、在留邦人向けメールマガジンや災害時等の一斉通報をサービスする「在留邦人向けメールマガジン配信システム」等の領事業務に関連する情報システムの安定的な運用を継続し、領事業務のＯＡ化を推進する。また，平成２２年４月に改定した「領事業務の業務・システム最適化計画」に則り，旅券発給管理システムを刷新する際に，新たに領事関連情報システム全体の基盤となる「領事業務情報システム」を構築したので，今後は，査証システムを含めた上記領事業務関連システムの統合を進め，更なる業務の効率化，国民サービスの向上等を目指す。,委託・請負,http://www.mofa.go.jp/mofaj/files/000091388.xlsx
36,2015,警察庁,0006,電子計算機運営,不明～終了予定なし,情報通信局,情報管理課,一般会計,別添参照,－,－,犯罪被害者等施策,指名手配、盗難車両、指掌紋等に関する捜査関連の情報、運転免許証に関する情報、銃砲等の許可に関する情報をはじめとする各種行政情報等をシステムで管理し、第一線警察官等が必要な時に必要な場所で必要な情報を活用可能とするなど、適正かつ効率的な警察活動を支えるため、各種システムを整備するとともに、安定稼働に資する。また、警察庁職員の事務処理を効率化するためのシステムを整備する。,第一線警察官からの照会への即時対応、運転免許証の即日交付、不正取得の防止及び点数制度に基づく行政処分の的確な運用、銃砲刀剣類所持等取締法の規制、その他業務の適正化等に関する法令の確実な実施のため、各種システムを整備しているが、万一、これらシステムが停止した場合は、第一線の警察活動及び国民生活に多大な影響を及ぼすことから、システムの安定稼働のため、職員による24時間365日のシステム運用、障害発生時の迅速な対応等を行う。また、警察庁職員の事務処理を効率化するため、電子メール、掲示板、府省共通業務等を行うためのシステムを整備する。,直接実施、委託・請負,https://www.npa.go.jp/yosan/kaikei/yosankanshi_kourituka/27review/pdf/26/26000600.pdf
37,2015,厚生労働省,0473,労働保険適用徴収業務に必要な経費,昭和４７年度～終了予定なし,労働基準局,労働保険徴収課,労働保険特別会計徴収勘定,労働保険適用促進及び労働保険料等の適正徴収を図ること（Ⅲ-8-1）,労働保険の保険料の徴収等に関する法律第10条第1項,-,,労働保険の適正な適用及び労働保険料の適正な徴収を図ること。,労働保険の適用対象事業（原則として、労働者を1人以上雇用する全ての事業に適用される）の把握・加入勧奨、労働保険事務組合の育成、納入督励などの労働保険の適用促進及び適正徴収に係る業務を実施する。,直接実施、委託・請負,http://www.mhlw.go.jp/jigyo_shiwake/gyousei_review_sheet/2015/h26_pdf_saisyu/473.pdf
38,2015,財務省,0025,輸出入・通関情報処理システム等経費,昭和５３年度～終了予定なし,関税局,総務課事務管理室,一般会計,5-3関税等の適正な賦課及び徴収、社会悪物品等の密輸阻止並びに税関手続における利用者利便の向上,・関税法・電子情報処理組織による輸出入等関連業務の処理等に関する法律,税関業務（輸出入及び港湾・空港手続関係業務）の業務・システム最適化計画,ＩＴ戦略,税関業務を迅速かつ効率的に処理するシステムを適切に運営、管理することにより、限られた人員の中で、適正かつ公平な税の課税・徴収、国の安全・安心の確保など税関の使命を的確に果たすとともに、利用者利便の向上を通じて国際物流等の迅速化・円滑化を図る。,NACCSは、輸出入等関連業務を行う者をオンラインで結び、輸出入等関連業務及びこれに関連する民間業務（貨物管理等）を一体的に処理する官民共同システムであり、CISは、輸出入申告実績、法人情報、審査・検査結果、要注意者情報等の通関情報総合判定に不可欠な各種情報をNACCSからのデータ移行又は税関職員の情報入力により蓄積し、税関の各部門のニーズに応じて様々な角度から集計・分析することを主要な機能としたシステムである。当該システムを活用し、我が国に輸出入される全ての貨物を国境で管理する一連の業務を行い、①安全・安心な社会の実現、②適正かつ公平な関税等の徴収、③貿易の円滑化を確保するために必要なNACCSの使用料及びCIS等の運営・改修等経費である。,直接実施,http://www.mof.go.jp/about_mof/mof_budget/review/2015/saishu/260025sheet.xls
39,2015,国土交通省,0163,空港等維持運営（空港）,昭和２７年度～終了予定なし,航空局,予算・管財室,自動車安全特別会計空港整備勘定,5安全で安心できる交通の確保、治安・生活安全の確保14公共交通の安全確保・鉄道の安全性向上、ハイジャック・航空機テロ防止を推進する。,航空法第47条第1項,－,交通安全対策、ＩＴ戦略,航空機の安全運航の確保を図りつつ、空港の円滑な運営、全国の空域の効率的な運用や航空事故防止等への対応に資するため、国管理空港、航空保安施設などの維持管理・運営を行う。,・滑走路、誘導路など空港土木施設の点検、清掃、修繕、除雪作業等・計器着陸装置、航空灯火など航空保安施設の点検、修理、保守等・航空路の監視レーダーなど航空路施設の点検、修理、保守等及び航空交通管制部の管理・運営・空港における警備や航空火災発生時の消防業務等・航空保安施設の飛行検査業務、航空管制官などを養成するための教育・研修施設の管理運営等,直接実施、委託・請負、補助、交付,http://www.mlit.go.jp/common/001102560.xlsx
41,2015,財務省,0002,予算編成支援システム,平成８年度～終了予定なし,主計局,総務課主計事務管理室,一般会計,1-1重点的な予算配分を通じた財政の効率化・質的改善の推進,財務省設置法第4条第2号財務省組織令第23条第9号,①予算・決算業務の業務・システム最適化計画（以下、「最適化計画」という。）②世界最先端IT国家創造宣言,ＩＴ戦略,予算編成支援システムは、国の予算編成業務及び決算作成業務の複雑多様化、予算書・決算書等の国会への早期提出、限られた人員での事務処理等に対処するため、的確かつ迅速な情報収集及び情報提供による事務作業の改善合理化を図るとともに、更に効率性及び信頼性の高いシステムを構築することにより、国の予算編成業務、決算作成業務等の効率化・合理化を図ることを目的としている。,予算編成支援システムは、財務省主計局の端末機と各省庁で整備されるＬＡＮの利用端末機等を利用し、政府共通ＮＷ等によるネットワークにより国の予算編成作業の効率化・合理化を図るため、各省庁からの概算要求から決定までの計数管理、予算の分析及び予算書の作成国の決算作成業務の効率化を図るため、各省庁の歳入・歳出に係る決算関係データが管理されている官庁会計システム(ADAMSⅡ)等のデータを活用し、決算の分析及び決算書の作成等を行うものである。,直接実施,http://www.mof.go.jp/about_mof/mof_budget/review/2015/saishu/260002sheet.xls
42,2015,法務省,0041,オンライン登記申請システムの維持管理,平成１６年度～終了予定なし,民事局,総務課,一般会計,国民の財産や身分関係の保護Ⅲ-9-(1)登記事務の適正円滑な処理,不動産登記法（平成16年法律第123号）第16条，第18条，第119条第1項，第120条第1項，第121条第1項，不動産登記令（平成16年政令第379号）第22条第1項，会社法（平成17年法律第86号）第907条，商業登記法（昭和38年法律第125号）第10条，第12条（外国法人の登記及び夫婦財産契約の登記に関する法律（明治31年法律第14号）第4条において準用する場合を含む。），第14条（外国法人の登記及び夫婦財産契約の登記に関する法律第4条において準用する場合を含む。），動産及び債権の譲渡の対抗要件に関する民法の特例等に関する法律（平成10年法律第104号）第7条，第8条，第9条，第10条，第11条第1項，第2項，第13条第1項，第2項，後見登記等に関する法律（平成11年法律第152号）第4条，第5条，第7条，第8条，第10条，附則第2条，供託法第2条，第8条,「新たな情報通信技術戦略」（平成22年5月11日ＩＴ戦略本部決定）「電子行政推進に関する基本方針」（平成23年8月3日ＩＴ戦略本部決定）「オンライン手続の利便性向上に向けた改善方針」（平成26年4月1日各府省情報化統括責任者（ＣＩＯ）連絡会議決定）「法務省改善取組計画」（平成26年10月3日策定）,ＩＴ戦略,不動産登記，商業・法人登記等の登記申請や証明書請求等の登記関係手続について，インターネット等を利用したオンラインによる申請（請求）を行うことを可能とし，国民サービスの向上を図る。,登記関係手続に関するオンラインによる申請（請求）を行うことを可能とするためのコンピュータシステムについて，安定的な運用及び管理を行うとともに，利用者の利便性の向上を図る。,直接実施、委託・請負,http://www.moj.go.jp/content/001151348.pdf
43,2015,経済産業省,0093,電子経済産業省構築事業（事務費）,平成１６年度～終了予定なし,大臣官房,情報システム厚生課,一般会計,2.個別産業2-4.IT,-,「世界最先端IT国家創造宣言」（平成25年6月14日閣議決定）,,行政内部の情報システム基盤の着実な整備・運用により、行政内部の業務の効率化や情報セキュリティの確保を図るとともに、ホームページや電子申請等を通じた国民向けサービスの向上を図る。,電子政府推進のプラットフォームとなる省内情報システム基盤の着実な整備・運用を行う。,委託・請負,http://www.meti.go.jp/information_2/publicoffer/review2015/saisyu/26009300METI.xlsx
44,2015,法務省,0014,検察総合情報管理システムの運営,平成１５年度～終了予定なし,刑事局,総務課,一般会計,検察権の適正迅速な行使Ⅱ-4-(2)検察権行使を支える事務の適正な運営,刑法，刑事訴訟法,「電子政府構築計画（平成15年7月17日各府省情報化統括責任者（CIO）連絡会議決定，平成16年6月14日一部改定）」「検察業務の業務・システム最適化計画（平成18年3月31日）」,,検察総合情報管理システムを安定的に稼働させることにより，検察庁の捜査・公判及び検務事務（以下「検察業務」という。）に関する情報等を総合的に運用・管理し，検察業務の効率化・合理化を図り，検察業務を迅速かつ的確に実施することを目的とする。,検察庁においては，検察官が犯罪の捜査，起訴・不起訴の決定，公判の維持遂行，裁判の執行の監督等を行っており，また，事件の受理から捜査・公判，刑の執行に至るまでに関連して生ずる様々な検務事務（事件事務・執行事務・証拠品事務・徴収事務・記録事務・犯歴事務）があるところ，これら捜査・公判，検務事務に関する情報や検察庁間における情報を総合的・一元的に管理・共有するために，全国の検察庁に検察総合情報管理システムを整備し，運用している。,委託・請負,http://www.moj.go.jp/content/001151320.pdf
45,2015,国土交通省,0079,数値予報業務,昭和３４年度～終了予定なし,気象庁予報部,業務課,一般会計,4水害等災害による被害の軽減10自然災害等による被害を軽減するため、気象情報等の提供及び観測・通信体制を充実する,気象業務法（第3条、第11条、第13条、第13条の２、第14条、第14条の２、第15条、第15条の２、第25条）、消防法（第22条）、水防法（第11条、第12条）、災害対策基本法（第3条、第8条）、交通安全対策基本法（第3条）他,防災基本計画（昭和38年中央防災会議策定）、世界気象機関条約、SOLAS条約（海上における人命の安全のための国際条約）,ＩＴ戦略,気象に関する警報・予報の作成のための基盤情報として必要不可欠な数値予報資料を作成する。,観測データ等を基に物理法則に基づく数値計算を行い、予報や警報等の基礎資料となる数値予報資料を作成する。精度の高い数値予報を行うためには、最新の気象学の知見を基に大気現象を精緻に表現できる数値予報モデルによる計算が必要であるが、その計算には膨大な計算機資源が必要となる。このため、数値解析予報システム（スーパーコンピュータ）により数値予報モデル計算の運用を行い、数値予報資料を作成する。,直接実施,http://www.mlit.go.jp/common/001095439.xlsx
46,2015,国土交通省,0078,気象データ交換業務,昭和３１年度～終了予定なし,気象庁予報部,業務課,一般会計,4水害等災害による被害の軽減10自然災害等による被害を軽減するため、気象情報等の提供及び観測・通信体制を充実する,気象業務法（第3条、第11条、第13条、第13条の２、第14条、第14条の２、第15条、第15条の２、第25条）、消防法（第22条）、水防法（第11条、第12条）、災害対策基本法（第3条、第8条）、交通安全対策基本法（第3条）他,防災基本計画（昭和38年中央防災会議策定）、世界気象機関条約、SOLAS条約（海上における人命の安全のための国際条約）,国土強靭化、ＩＴ戦略,気象業務の円滑な遂行の基盤として、国内・国外の観測資料や予報・警報等の各種気象情報を即時的に収集・交換する。,防災気象情報等の作成に不可欠な各種観測資料や数値予報資料をはじめとする、気象業務に関する国内・国外の各種資料を、気象情報伝送処理システムを通じて、２４時間休止することなく迅速・効率的に収集・交換する。,直接実施,http://www.mlit.go.jp/common/001095400.xlsx
47,2015,総務省,0036,電子政府関連事業（政府情報システム基盤整備）,平成１５年度～終了予定なし,行政管理局,行政情報システム企画課,一般会計,政策８：電子政府・電子自治体の推進,○総務省設置法第4条第10号及び第12号○高度情報通信ネットワーク社会形成基本法第20条○行政手続等における情報通信の技術の利用に関する法律,○デジタル新時代に向けた新たな戦略～三か年緊急プラン～（H21.4.9IT戦略本部決定）○世界最先端IT国家創造宣言（H25.6.14閣議決定）○世界最先端IT国家創造宣言工程表（H25.6.14閣議決定）○経済財政運営と改革の基本方針～脱デフレ・経済再生～（H25.6.14閣議決定）○日本再興戦略-JAPANisBACK-（H25.6.14閣議決定）,ＩＴ戦略,○便利なくらしをつくる国民等が電子的に申請等を行う際の電子文書の真正性の担保（なりすまし・改ざん防止）に必要不可欠な認証基盤等を一元的に管理・運営するとともに、クラウドコンピューティング技術を活用した政府共通プラットフォームを中心とした政府情報システムの基盤を構築し、政府情報システムの統合・集約化等を推進することにより、情報システムを強化し、政府全体の効率的な行政運営や徹底したコスト削減、安全性・信頼性を向上。,○政府全体で共用するシステム基盤の管理・運営次に掲げる事業を実施する。・政府認証基盤、職員等利用者認証基盤、共同利用システム基盤及び国家公務員ICカード身分証府省間データ交換サーバシステムの一元的な管理・運営。・政府共通プラットフォームの円滑な運用、対象システムに対する同プラットフォームへの移行支援の実施、拠点の分散化及び一元的なセキュリティ対策の実施。・政府共通ネットワークの円滑な運用。,直接実施、委託・請負,http://www.soumu.go.jp/main_content/000402866.pdf
48,2015,総務省,0115,総合無線局監理システムの構築と運用,平成５年度～終了予定なし,総合通信基盤局,電波政策課電波利用料企画室,一般会計,Ⅴ-５電波利用料財源による電波監視等の実施,電波法第１０３条の２第４項第２号,・新たなオンライン利用に関する計画（H23.8ＩＴ戦略本部決定）・オンライン手続の利便性向上に向けた改善方針（H26.4.1CIO連絡会議決定）,ＩＴ戦略,無線局データベースを基盤とした全国規模の総合的な業務処理システムについて、近年急速に無線局が増加し、無線局監理事務の増大が見込まれる中、運用コストの抑制を図りながら同システムの継続的かつ安定的な運用を確保するとともに、システムの高度化等を実現することにより、無線局監理事務の効率化、無線局免許人への行政サービスの向上等を実現することを目的とする。,平成５年度から３年を１期として、段階的に総合無線局監理システムを構築・更改するとともに、同システムの活用により、年々増加する無線局の免許処理等（年間約３０～６０万件）を迅速かつ効率的に実施。また、無線局免許人に対しては、同システムを通じて、無線局免許申請等に有効な各種関連情報を提供。,直接実施、委託・請負,http://www.soumu.go.jp/main_content/000375749.pdf
49,2015,財務省,0017,府省共通国有財産総合情報管理システム,平成２１年度～終了予定なし,理財局,管理課,一般会計,3-3庁舎及び宿舎を含む国有財産の適正な管理・処分及び有効活用と情報提供の充実,国有財産法（第9条の5、第32条など）,国有財産関係業務（官庁営繕業務を除く。）の業務・システム最適化計画、電子政府構築計画,ＩＴ戦略,国有財産法等に基づく国有財産台帳等法定帳簿の整備、台帳価格改定業務（毎年度実施）及び、国会報告のための国有財産増減及び現在額報告書等の効率化及びシステム経常経費の削減を目的とする。,国有財産総合情報管理システムは、従来のシステム及び各府省が区々に開発していたシステムを統廃合し、新たに府省共通システムとして開発を行い、平成22年1月より運用を開始している。事業を実施することにより、業務処理の正確性の向上を図るとともに、①業務の効率化・合理化、②情報公開の積極的な展開、③府省横断的な共通システム構築による経費削減、④他の府省共通システム等との効果的な連携、⑤安全性・信頼性の確保を図っている。,直接実施,http://www.mof.go.jp/about_mof/mof_budget/review/2015/saishu/260017sheet.xls
50,2015,総務省,0033,総務省ＬＡＮ整備・運用事業,平成１２年度～終了予定なし,大臣官房,企画課情報システム室,一般会計,Ⅳ電子政府・電子自治体の推進,総務省組織令第３条,・行政情報化推進基本計画（平成６年12月25日閣議決定）・電子政府構築計画（平成15年７月17日各府省情報化統括責任者（ＣＩＯ）連絡会議決定）・総務省情報ネットワーク（共通システム）最適化計画（平成17年６月29日総務省行政情報化推進委員会決定）・総務省電子政府推進計画（平成20年3月28日総務省行政情報化推進委員会決定）,ＩＴ戦略,行政情報の電子化による事務・事業の簡素化・効率化を推進するための基盤として、総務省全体の総合的ネットワークを構築する。,全国約80拠点の庁舎、約7500名のユーザをネットワーク（回線）で接続し、電子メール、電子掲示板、ファイル共有、インターネット・政府共通ネットワーク接続の機能を提供する基盤として、総務省ＬＡＮを統一的に整備・運用する。また、各部局が利用する業務システムの基盤として必要となる機能を提供する。,委託・請負,http://www.soumu.go.jp/main_content/000375640.pdf
